{
  "id": "SCN-02",
  "name": "Queue with Popup",
  "initial_state": "S0",
  "policy_profile": "default",
  "events": [
    { "event_type": "FLOW_START", "source": "mock" },
    { "event_type": "ENTRY_ENABLED", "source": "mock" },
    { "event_type": "QUEUE_SHOWN", "source": "mock", "stage": "S2" },
    { "event_type": "POPUP_OPENED", "source": "mock", "stage": "S2", "context": { "popup_type": "ticketing_window" } },
    { "event_type": "SECTION_SELECTED", "source": "mock", "stage": "S4", "context": { "section_id": "B" } },
    { "event_type": "SEAT_SELECTED", "source": "mock", "stage": "S5", "context": { "seat_id": "B-11" } },
    { "event_type": "HOLD_ACQUIRED", "source": "mock", "stage": "S5" },
    { "event_type": "PAYMENT_COMPLETED", "source": "mock", "stage": "S6" }
  ],
  "accept": {
    "final_state": "SX",
    "terminal_reason": "done",
    "asserts": [
      { "type": "state_path_contains", "value": ["S2", "S4", "S5", "SX"] },
      { "type": "log_lines_at_least", "value": 8 }
    ]
  }
}
