{
  "id": "SCN-08",
  "name": "Section Empty Exhaust",
  "initial_state": "S0",
  "policy_profile": "section_strict",
  "events": [
    { "event_type": "FLOW_START", "source": "mock" },
    { "event_type": "ENTRY_ENABLED", "source": "mock" },
    { "event_type": "QUEUE_PASSED", "source": "mock" },
    { "event_type": "SECTION_LIST_READY", "source": "mock" },
    { "event_type": "SECTION_EMPTY", "source": "mock" },
    { "event_type": "SECTION_EMPTY", "source": "mock" },
    { "event_type": "SECTION_EMPTY", "source": "mock" },
    { "event_type": "SECTION_EMPTY", "source": "mock" }
  ],
  "accept": {
    "final_state": "SX",
    "terminal_reason": "abort",
    "asserts": [
      { "type": "state_path_contains", "value": ["S4", "SX"] }
    ]
  }
}
